{
  "$schema": "../../../schemas/v1/operation.schema.json",
  "operation_id": "collection_operations.delete_collection",
  "inventory_key": "documentation:ConstructionOperations/Collections/DeleteCollection.htm",
  "mp_step": "Delete Collection",
  "category": "Collection Operations",
  "protocol": {
    "service": "CollectionOperations",
    "rpc": "DeleteCollection",
    "request": "DeleteCollectionRequest",
    "result": "DeleteCollectionResult"
  },
  "stability": "experimental",
  "execution_scope": "global_state_mutation",
  "risk": {
    "effect": "mutating",
    "replay_safety": "unknown",
    "flags": []
  },
  "documentation": {
    "summary": "Deletes one explicitly named collection.",
    "isolation": "Mutates application-global collection state. Cancellation or deadline expiry does not roll back deletion or cancel an in-flight COM call; an ambiguous completion requires reconciliation before replay."
  },
  "arguments": [
    {
      "argument_id": "collection_name",
      "ordinal": 0,
      "sdk_order": 0,
      "mp_name": "Name of Collection to Delete",
      "direction": "input",
      "result_only": "no",
      "semantic_type": "collection_name",
      "data_classification": "object_identifier",
      "field_numbers": {
        "request": 1,
        "result": null
      },
      "input": {
        "presence": "required",
        "omission_behavior": "reject_request",
        "default": {
          "status": "none"
        }
      },
      "sdk_binding": {
        "status": "available",
        "setter": "SetCollectionNameArg",
        "getter": null
      },
      "documentation": "The exact collection name to delete."
    }
  ],
  "evidence": [
    {
      "source_id": "maintainer_review",
      "reference": "Issues #49, #53, and #64 exact-target collection-mutation review"
    },
    {
      "source_id": "sa_mp_command_reference",
      "reference": "ConstructionOperations/Collections/DeleteCollection.htm"
    },
    {
      "source_id": "sa_view_sdk_code",
      "reference": "ConstructionOperations_Collections.txt: Delete Collection"
    }
  ]
}
