{
  "$schema": "../../../schemas/v1/operation.schema.json",
  "operation_id": "collection_operations.get_point_count_in_group",
  "inventory_key": "documentation:AnalysisOperations/GetNumberOfPointsInGroup.htm",
  "mp_step": "Get Number of Points in Group",
  "category": "Collection Operations",
  "protocol": {
    "service": "CollectionOperations",
    "rpc": "GetPointCountInGroup",
    "request": "GetPointCountInGroupRequest",
    "result": "GetPointCountInGroupResult"
  },
  "stability": "experimental",
  "execution_scope": "global_state_read",
  "risk": {
    "effect": "read_only",
    "replay_safety": "safe",
    "flags": []
  },
  "documentation": {
    "summary": "Returns the number of points in a named SpatialAnalyzer group.",
    "isolation": "Reads application-global model state. The count can change independently of earlier group or point-list queries."
  },
  "arguments": [
    {
      "argument_id": "group",
      "ordinal": 0,
      "sdk_order": 0,
      "mp_name": "Group Name",
      "direction": "input",
      "result_only": "no",
      "semantic_type": "collection_object_name",
      "data_classification": "object_identifier",
      "field_numbers": {
        "request": 1,
        "result": null
      },
      "input": {
        "presence": "required",
        "omission_behavior": "reject_request",
        "default": {
          "status": "none"
        }
      },
      "sdk_binding": {
        "status": "available",
        "setter": "SetCollectionObjectNameArg2",
        "getter": null
      },
      "documentation": "The exact collection/object identity of the point group to inspect."
    },
    {
      "argument_id": "point_count",
      "ordinal": 1,
      "sdk_order": 1,
      "mp_name": "Total Count",
      "direction": "output",
      "result_only": "yes",
      "semantic_type": "whole_number",
      "data_classification": "measurement",
      "field_numbers": {
        "request": null,
        "result": 1
      },
      "sdk_binding": {
        "status": "available",
        "setter": null,
        "getter": "GetIntegerArg"
      },
      "documentation": "The number of points in the group at command execution time."
    }
  ],
  "evidence": [
    {
      "source_id": "maintainer_review",
      "reference": "Issue #63 initial Wave 1 release subset review"
    },
    {
      "source_id": "sa_mp_command_reference",
      "reference": "AnalysisOperations/GetNumberOfPointsInGroup.htm"
    },
    {
      "source_id": "sa_view_sdk_code",
      "reference": "AnalysisOperations.txt: Get Number of Points in Group"
    }
  ]
}
