{
  "$schema": "../../../schemas/v1/operation.schema.json",
  "operation_id": "collection_operations.construct_point_in_working_coordinates",
  "inventory_key": "documentation:ConstructionOperations/PointsandGroups/ConstructAPointInWorkingCoordinates.htm",
  "mp_step": "Construct a Point in Working Coordinates",
  "category": "Collection Operations",
  "protocol": {
    "service": "CollectionOperations",
    "rpc": "ConstructPointInWorkingCoordinates",
    "request": "ConstructPointInWorkingCoordinatesRequest",
    "result": "ConstructPointInWorkingCoordinatesResult"
  },
  "stability": "experimental",
  "execution_scope": "global_state_mutation",
  "risk": {
    "effect": "mutating",
    "replay_safety": "unknown",
    "flags": []
  },
  "documentation": {
    "summary": "Constructs a named point at explicit working-frame coordinates.",
    "isolation": "Mutates named geometry in application-global model state. Cancellation or deadline expiry does not roll back the command or cancel an in-flight COM call; an ambiguous completion requires reconciliation before replay."
  },
  "arguments": [
    {
      "argument_id": "point_name",
      "ordinal": 0,
      "sdk_order": 0,
      "mp_name": "Point Name",
      "direction": "input",
      "result_only": "no",
      "semantic_type": "point_name",
      "data_classification": "object_identifier",
      "field_numbers": {
        "request": 1,
        "result": null
      },
      "input": {
        "presence": "required",
        "omission_behavior": "reject_request",
        "default": {
          "status": "none"
        }
      },
      "sdk_binding": {
        "status": "available",
        "setter": "SetPointNameArg",
        "getter": null
      },
      "documentation": "The exact collection, group, and target name for the point to construct."
    },
    {
      "argument_id": "working_coordinates",
      "ordinal": 1,
      "sdk_order": 1,
      "mp_name": "Working Coordinates",
      "direction": "input",
      "result_only": "no",
      "semantic_type": "vector3",
      "data_classification": "geometry",
      "field_numbers": {
        "request": 2,
        "result": null
      },
      "input": {
        "presence": "required",
        "omission_behavior": "reject_request",
        "default": {
          "status": "none"
        }
      },
      "sdk_binding": {
        "status": "available",
        "setter": "SetVectorArg",
        "getter": null
      },
      "documentation": "All three coordinates in the active working frame. The generated zero-vector sample is not an omission default."
    }
  ],
  "evidence": [
    {
      "source_id": "maintainer_review",
      "reference": "Issues #49, #53, #64, and #82 exact-target mutation review"
    },
    {
      "source_id": "sa_mp_command_reference",
      "reference": "ConstructionOperations/PointsandGroups/ConstructAPointInWorkingCoordinates.htm"
    },
    {
      "source_id": "sa_view_sdk_code",
      "reference": "ConstructionOperations_PointsAndGroups.txt: Construct a Point in Working Coordinates"
    }
  ]
}
