{
  "$schema": "../../../schemas/v1/operation.schema.json",
  "operation_id": "collection_operations.list_groups_in_collection",
  "inventory_key": "documentation:ConstructionOperations/OtherMPTypes/MakeACollectionObjectNameRefListCollection.htm",
  "mp_step": "Make a Collection Object Name Ref List from all Groups in a Collection",
  "category": "Collection Operations",
  "protocol": {
    "service": "CollectionOperations",
    "rpc": "ListGroupsInCollection",
    "request": "ListGroupsInCollectionRequest",
    "result": "ListGroupsInCollectionResult"
  },
  "stability": "experimental",
  "execution_scope": "global_state_read",
  "risk": {
    "effect": "read_only",
    "replay_safety": "safe",
    "flags": []
  },
  "documentation": {
    "summary": "Returns the group object identities currently present in a named collection.",
    "isolation": "Reads application-global model state. The returned list is point-in-time data and does not create an exclusive collection snapshot."
  },
  "arguments": [
    {
      "argument_id": "collection_name",
      "ordinal": 0,
      "sdk_order": 0,
      "mp_name": "Collection Name",
      "direction": "input",
      "result_only": "no",
      "semantic_type": "collection_name",
      "data_classification": "object_identifier",
      "field_numbers": {
        "request": 1,
        "result": null
      },
      "input": {
        "presence": "required",
        "omission_behavior": "reject_request",
        "default": {
          "status": "none"
        }
      },
      "sdk_binding": {
        "status": "available",
        "setter": "SetCollectionNameArg",
        "getter": null
      },
      "documentation": "The exact collection name whose groups will be listed."
    },
    {
      "argument_id": "groups",
      "ordinal": 1,
      "sdk_order": 1,
      "mp_name": "Collection Object Name List",
      "direction": "output",
      "result_only": "yes",
      "semantic_type": "collection_object_name_list",
      "data_classification": "object_identifier",
      "field_numbers": {
        "request": null,
        "result": 1
      },
      "sdk_binding": {
        "status": "available",
        "setter": null,
        "getter": "GetCollectionObjectNameRefListArg"
      },
      "documentation": "The ordered collection/object identities returned by the exact MP command."
    }
  ],
  "evidence": [
    {
      "source_id": "maintainer_review",
      "reference": "Issue #63 initial Wave 1 release subset review"
    },
    {
      "source_id": "sa_mp_command_reference",
      "reference": "ConstructionOperations/OtherMPTypes/MakeACollectionObjectNameRefListCollection.htm"
    },
    {
      "source_id": "sa_view_sdk_code",
      "reference": "ConstructionOperations_OtherMPTypes.txt: Make a Collection Object Name Ref List from all Groups in a Collection"
    }
  ]
}
