{
  "$schema": "../../../schemas/v1/operation.schema.json",
  "operation_id": "collection_operations.rename_point",
  "inventory_key": "documentation:ConstructionOperations/RenamePoint.htm",
  "mp_step": "Rename Point",
  "category": "Collection Operations",
  "protocol": {
    "service": "CollectionOperations",
    "rpc": "RenamePoint",
    "request": "RenamePointRequest",
    "result": "RenamePointResult"
  },
  "stability": "experimental",
  "execution_scope": "global_state_mutation",
  "risk": {
    "effect": "mutating",
    "replay_safety": "unknown",
    "flags": []
  },
  "documentation": {
    "summary": "Renames an explicitly identified point, with reviewed collision behavior selected by the caller.",
    "isolation": "Mutates named geometry in application-global model state. Cancellation or deadline expiry does not roll back the rename or cancel an in-flight COM call; an ambiguous completion requires reconciliation before replay."
  },
  "arguments": [
    {
      "argument_id": "original_point_name",
      "ordinal": 0,
      "sdk_order": 0,
      "mp_name": "Original Point Name",
      "direction": "input",
      "result_only": "no",
      "semantic_type": "point_name",
      "data_classification": "object_identifier",
      "field_numbers": {
        "request": 1,
        "result": null
      },
      "input": {
        "presence": "required",
        "omission_behavior": "reject_request",
        "default": {
          "status": "none"
        }
      },
      "sdk_binding": {
        "status": "available",
        "setter": "SetPointNameArg",
        "getter": null
      },
      "documentation": "The exact existing collection, group, and target name to rename."
    },
    {
      "argument_id": "new_point_name",
      "ordinal": 1,
      "sdk_order": 1,
      "mp_name": "New Point Name",
      "direction": "input",
      "result_only": "no",
      "semantic_type": "point_name",
      "data_classification": "object_identifier",
      "field_numbers": {
        "request": 2,
        "result": null
      },
      "input": {
        "presence": "required",
        "omission_behavior": "reject_request",
        "default": {
          "status": "none"
        }
      },
      "sdk_binding": {
        "status": "available",
        "setter": "SetPointNameArg",
        "getter": null
      },
      "documentation": "The exact collection, group, and target name to assign."
    },
    {
      "argument_id": "overwrite_if_exists",
      "ordinal": 2,
      "sdk_order": 2,
      "mp_name": "Overwrite if exists?",
      "direction": "input",
      "result_only": "no",
      "semantic_type": "logical",
      "data_classification": "non_sensitive",
      "field_numbers": {
        "request": 3,
        "result": null
      },
      "input": {
        "presence": "optional",
        "omission_behavior": "set_catalog_default",
        "default": {
          "status": "reviewed",
          "value": false
        }
      },
      "sdk_binding": {
        "status": "available",
        "setter": "SetBoolArg",
        "getter": null
      },
      "documentation": "Whether SpatialAnalyzer may overwrite an existing point at the destination name. Omission explicitly sends the reviewed false default."
    }
  ],
  "evidence": [
    {
      "source_id": "maintainer_review",
      "reference": "Issues #49, #53, #64, and #82 exact-target mutation review"
    },
    {
      "source_id": "sa_mp_command_reference",
      "reference": "ConstructionOperations/RenamePoint.htm"
    },
    {
      "source_id": "sa_view_sdk_code",
      "reference": "ConstructionOperations.txt: Rename Point"
    }
  ]
}
