{
  "$schema": "../../../schemas/v1/operation.schema.json",
  "operation_id": "collection_operations.copy_objects_to_collection",
  "inventory_key": "documentation:ConstructionOperations/CopyObjectstoacollection.htm",
  "mp_step": "Copy Objects to a collection",
  "category": "Collection Operations",
  "protocol": {
    "service": "CollectionOperations",
    "rpc": "CopyObjectsToCollection",
    "request": "CopyObjectsToCollectionRequest",
    "result": "CopyObjectsToCollectionResult"
  },
  "stability": "experimental",
  "execution_scope": "global_state_mutation",
  "risk": {
    "effect": "mutating",
    "replay_safety": "unknown",
    "flags": []
  },
  "documentation": {
    "summary": "Copies an explicit list of collection objects into a destination collection.",
    "isolation": "Mutates application-global model state. Cancellation or deadline expiry does not roll back copied objects or cancel an in-flight COM call; an ambiguous completion requires reconciliation before replay."
  },
  "arguments": [
    {
      "argument_id": "source_objects",
      "ordinal": 0,
      "sdk_order": 0,
      "mp_name": "Source Objects",
      "direction": "input",
      "result_only": "no",
      "semantic_type": "collection_object_name_list",
      "data_classification": "object_identifier",
      "field_numbers": {
        "request": 1,
        "result": null
      },
      "input": {
        "presence": "required",
        "omission_behavior": "reject_request",
        "default": {
          "status": "none"
        }
      },
      "sdk_binding": {
        "status": "available",
        "setter": "SetCollectionObjectNameRefListArg",
        "getter": null
      },
      "documentation": "The exact collection/object identities to copy."
    },
    {
      "argument_id": "destination_collection_name",
      "ordinal": 1,
      "sdk_order": 1,
      "mp_name": "Destination Collection Name",
      "direction": "input",
      "result_only": "no",
      "semantic_type": "collection_name",
      "data_classification": "object_identifier",
      "field_numbers": {
        "request": 2,
        "result": null
      },
      "input": {
        "presence": "required",
        "omission_behavior": "reject_request",
        "default": {
          "status": "none"
        }
      },
      "sdk_binding": {
        "status": "available",
        "setter": "SetCollectionNameArg",
        "getter": null
      },
      "documentation": "The exact destination collection name."
    }
  ],
  "evidence": [
    {
      "source_id": "maintainer_review",
      "reference": "Issues #49, #53, and #64 exact-target collection-mutation review"
    },
    {
      "source_id": "sa_mp_command_reference",
      "reference": "ConstructionOperations/CopyObjectstoacollection.htm"
    },
    {
      "source_id": "sa_view_sdk_code",
      "reference": "ConstructionOperations.txt: Copy Objects to a collection"
    }
  ]
}
