{
  "$schema": "../../../schemas/v1/operation.schema.json",
  "operation_id": "collection_operations.set_collection_notes",
  "inventory_key": "documentation:UtilityOperations/Notes/SetCollectionNotes.htm",
  "mp_step": "Set Collection Notes",
  "category": "Collection Operations",
  "protocol": {
    "service": "CollectionOperations",
    "rpc": "SetCollectionNotes",
    "request": "SetCollectionNotesRequest",
    "result": "SetCollectionNotesResult"
  },
  "stability": "experimental",
  "execution_scope": "global_state_mutation",
  "risk": {
    "effect": "mutating",
    "replay_safety": "unknown",
    "flags": []
  },
  "documentation": {
    "summary": "Appends to or replaces the notes attached to an explicitly identified collection.",
    "isolation": "Mutates collection metadata in application-global model state. Cancellation or deadline expiry does not roll back the notes change or cancel an in-flight COM call; an ambiguous completion requires reconciliation before replay."
  },
  "arguments": [
    {
      "argument_id": "collection_name",
      "ordinal": 0,
      "sdk_order": 0,
      "mp_name": "Collection",
      "direction": "input",
      "result_only": "no",
      "semantic_type": "collection_name",
      "data_classification": "object_identifier",
      "field_numbers": {
        "request": 1,
        "result": null
      },
      "input": {
        "presence": "required",
        "omission_behavior": "reject_request",
        "default": {
          "status": "none"
        }
      },
      "sdk_binding": {
        "status": "available",
        "setter": "SetCollectionNameArg",
        "getter": null
      },
      "documentation": "The exact collection whose notes are changed."
    },
    {
      "argument_id": "notes",
      "ordinal": 1,
      "sdk_order": 1,
      "mp_name": "Notes",
      "direction": "input",
      "result_only": "no",
      "semantic_type": "edit_text",
      "data_classification": "proprietary",
      "field_numbers": {
        "request": 2,
        "result": null
      },
      "input": {
        "presence": "required",
        "omission_behavior": "reject_request",
        "default": {
          "status": "none"
        }
      },
      "sdk_binding": {
        "status": "available",
        "setter": "SetEditTextArg",
        "getter": null
      },
      "documentation": "The ordered note lines to append or use as the replacement text."
    },
    {
      "argument_id": "append",
      "ordinal": 2,
      "sdk_order": 2,
      "mp_name": "Append? (FALSE = Overwrite)",
      "direction": "input",
      "result_only": "no",
      "semantic_type": "logical",
      "data_classification": "non_sensitive",
      "field_numbers": {
        "request": 3,
        "result": null
      },
      "input": {
        "presence": "optional",
        "omission_behavior": "set_catalog_default",
        "default": {
          "status": "reviewed",
          "value": true
        }
      },
      "sdk_binding": {
        "status": "available",
        "setter": "SetBoolArg",
        "getter": null
      },
      "documentation": "Whether to append to the current notes. Omission explicitly sends the reviewed true default; false replaces the current notes."
    }
  ],
  "evidence": [
    {
      "source_id": "maintainer_review",
      "reference": "Issues #51, #53, #64, and #82 exact-target note-mutation review"
    },
    {
      "source_id": "sa_mp_command_reference",
      "reference": "UtilityOperations/Notes/SetCollectionNotes.htm"
    },
    {
      "source_id": "sa_view_sdk_code",
      "reference": "UtilityOperations_Notes.txt: Set Collection Notes"
    }
  ]
}
