{
  "$schema": "../../../schemas/v1/operation.schema.json",
  "operation_id": "collection_operations.rename_object",
  "inventory_key": "documentation:ConstructionOperations/RenameObject.htm",
  "mp_step": "Rename Object",
  "category": "Collection Operations",
  "protocol": {
    "service": "CollectionOperations",
    "rpc": "RenameObject",
    "request": "RenameObjectRequest",
    "result": "RenameObjectResult"
  },
  "stability": "experimental",
  "execution_scope": "global_state_mutation",
  "risk": {
    "effect": "mutating",
    "replay_safety": "unknown",
    "flags": []
  },
  "documentation": {
    "summary": "Renames one explicitly identified collection object.",
    "isolation": "Mutates named geometry in application-global model state. Cancellation or deadline expiry does not roll back the rename or cancel an in-flight COM call; an ambiguous completion requires reconciliation before replay."
  },
  "arguments": [
    {
      "argument_id": "original_object_name",
      "ordinal": 0,
      "sdk_order": 0,
      "mp_name": "Original Object Name",
      "direction": "input",
      "result_only": "no",
      "semantic_type": "collection_object_name",
      "data_classification": "object_identifier",
      "field_numbers": {
        "request": 1,
        "result": null
      },
      "input": {
        "presence": "required",
        "omission_behavior": "reject_request",
        "default": {
          "status": "none"
        }
      },
      "sdk_binding": {
        "status": "available",
        "setter": "SetCollectionObjectNameArg2",
        "getter": null
      },
      "documentation": "The exact existing collection/object identity to rename."
    },
    {
      "argument_id": "new_object_name",
      "ordinal": 1,
      "sdk_order": 1,
      "mp_name": "New Object Name",
      "direction": "input",
      "result_only": "no",
      "semantic_type": "collection_object_name",
      "data_classification": "object_identifier",
      "field_numbers": {
        "request": 2,
        "result": null
      },
      "input": {
        "presence": "required",
        "omission_behavior": "reject_request",
        "default": {
          "status": "none"
        }
      },
      "sdk_binding": {
        "status": "available",
        "setter": "SetCollectionObjectNameArg2",
        "getter": null
      },
      "documentation": "The exact collection/object identity to assign."
    },
    {
      "argument_id": "overwrite_if_exists",
      "ordinal": 2,
      "sdk_order": 2,
      "mp_name": "Overwrite if exists?",
      "direction": "input",
      "result_only": "no",
      "semantic_type": "logical",
      "data_classification": "non_sensitive",
      "field_numbers": {
        "request": 3,
        "result": null
      },
      "input": {
        "presence": "optional",
        "omission_behavior": "set_catalog_default",
        "default": {
          "status": "reviewed",
          "value": false
        }
      },
      "sdk_binding": {
        "status": "available",
        "setter": "SetBoolArg",
        "getter": null
      },
      "documentation": "Whether SpatialAnalyzer may replace an existing object at the requested destination identity. Omission explicitly sends the reviewed false default."
    }
  ],
  "evidence": [
    {
      "source_id": "maintainer_review",
      "reference": "Issues #49, #53, #64, and #82 exact-target object-lifecycle review"
    },
    {
      "source_id": "sa_mp_command_reference",
      "reference": "ConstructionOperations/RenameObject.htm"
    },
    {
      "source_id": "sa_view_sdk_code",
      "reference": "ConstructionOperations.txt: Rename Object"
    }
  ]
}
