{
  "$schema": "../../../schemas/v1/operation.schema.json",
  "operation_id": "collection_operations.delete_objects",
  "inventory_key": "documentation:UtilityOperations/Units/DeleteObjects.htm",
  "mp_step": "Delete Objects",
  "category": "Collection Operations",
  "protocol": {
    "service": "CollectionOperations",
    "rpc": "DeleteObjects",
    "request": "DeleteObjectsRequest",
    "result": "DeleteObjectsResult"
  },
  "stability": "experimental",
  "execution_scope": "global_state_mutation",
  "risk": {
    "effect": "mutating",
    "replay_safety": "unknown",
    "flags": []
  },
  "documentation": {
    "summary": "Deletes an explicit list of named collection objects.",
    "isolation": "Mutates named geometry in application-global model state. Cancellation or deadline expiry does not roll back deletion or cancel an in-flight COM call; an ambiguous completion requires reconciliation before replay."
  },
  "arguments": [
    {
      "argument_id": "object_names",
      "ordinal": 0,
      "sdk_order": 0,
      "mp_name": "Object Names",
      "direction": "input",
      "result_only": "no",
      "semantic_type": "collection_object_name_list",
      "data_classification": "object_identifier",
      "field_numbers": {
        "request": 1,
        "result": null
      },
      "input": {
        "presence": "required",
        "omission_behavior": "reject_request",
        "default": {
          "status": "none"
        }
      },
      "sdk_binding": {
        "status": "available",
        "setter": "SetCollectionObjectNameRefListArg",
        "getter": null
      },
      "documentation": "The exact collection/object identities to delete."
    }
  ],
  "evidence": [
    {
      "source_id": "maintainer_review",
      "reference": "Issues #49, #53, and #64 exact-target object-lifecycle review"
    },
    {
      "source_id": "sa_mp_command_reference",
      "reference": "UtilityOperations/Units/DeleteObjects.htm"
    },
    {
      "source_id": "sa_view_sdk_code",
      "reference": "UtilityOperations.txt: Delete Objects"
    }
  ]
}
