{
  "$schema": "../../../schemas/v1/operation.schema.json",
  "operation_id": "collection_operations.get_collection_name_by_index",
  "inventory_key": "documentation:AnalysisOperations/GetI-thCollectionName.htm",
  "mp_step": "Get i-th Collection Name",
  "category": "Collection Operations",
  "protocol": {
    "service": "CollectionOperations",
    "rpc": "GetCollectionNameByIndex",
    "request": "GetCollectionNameByIndexRequest",
    "result": "GetCollectionNameByIndexResult"
  },
  "stability": "experimental",
  "execution_scope": "global_state_read",
  "risk": {
    "effect": "read_only",
    "replay_safety": "safe",
    "flags": []
  },
  "documentation": {
    "summary": "Returns the collection name at an explicit SpatialAnalyzer collection index.",
    "isolation": "Reads application-global model state. Collection ordering can change between calls, so callers must not treat a prior count and this lookup as one atomic snapshot."
  },
  "arguments": [
    {
      "argument_id": "collection_index",
      "ordinal": 0,
      "sdk_order": 0,
      "mp_name": "Collection Index",
      "direction": "input",
      "result_only": "no",
      "semantic_type": "whole_number",
      "data_classification": "object_identifier",
      "field_numbers": {
        "request": 1,
        "result": null
      },
      "input": {
        "presence": "required",
        "omission_behavior": "reject_request",
        "default": {
          "status": "none"
        }
      },
      "sdk_binding": {
        "status": "available",
        "setter": "SetIntegerArg",
        "getter": null
      },
      "documentation": "The explicit collection index passed to SpatialAnalyzer; Briosa does not infer a default."
    },
    {
      "argument_id": "collection_name",
      "ordinal": 1,
      "sdk_order": 1,
      "mp_name": "Resultant Name",
      "direction": "output",
      "result_only": "yes",
      "semantic_type": "collection_name",
      "data_classification": "object_identifier",
      "field_numbers": {
        "request": null,
        "result": 1
      },
      "sdk_binding": {
        "status": "available",
        "setter": null,
        "getter": "GetCollectionNameArg"
      },
      "documentation": "The collection name returned for the requested index."
    }
  ],
  "evidence": [
    {
      "source_id": "maintainer_review",
      "reference": "Issues #63 and #82 explicit-input review"
    },
    {
      "source_id": "sa_mp_command_reference",
      "reference": "AnalysisOperations/GetI-thCollectionName.htm"
    },
    {
      "source_id": "sa_view_sdk_code",
      "reference": "AnalysisOperations.txt: Get i-th Collection Name"
    }
  ]
}
