{
  "$schema": "../../../schemas/v1/operation.schema.json",
  "operation_id": "collection_operations.construct_point_at_line_midpoint",
  "inventory_key": "documentation:ConstructionOperations/PointsandGroups/ConstructaPointAtLineMidPoint.htm",
  "mp_step": "Construct a Point at line MidPoint",
  "category": "Collection Operations",
  "protocol": {
    "service": "CollectionOperations",
    "rpc": "ConstructPointAtLineMidpoint",
    "request": "ConstructPointAtLineMidpointRequest",
    "result": "ConstructPointAtLineMidpointResult"
  },
  "stability": "experimental",
  "execution_scope": "global_state_mutation",
  "risk": {
    "effect": "mutating",
    "replay_safety": "unknown",
    "flags": []
  },
  "documentation": {
    "summary": "Constructs a named point at the midpoint of an explicitly identified line.",
    "isolation": "Mutates named geometry in application-global model state. Cancellation or deadline expiry does not roll back construction or cancel an in-flight COM call; an ambiguous completion requires reconciliation before replay."
  },
  "arguments": [
    {
      "argument_id": "line",
      "ordinal": 0,
      "sdk_order": 0,
      "mp_name": "Line Name",
      "direction": "input",
      "result_only": "no",
      "semantic_type": "collection_object_name",
      "data_classification": "object_identifier",
      "field_numbers": {
        "request": 1,
        "result": null
      },
      "input": {
        "presence": "required",
        "omission_behavior": "reject_request",
        "default": {
          "status": "none"
        }
      },
      "sdk_binding": {
        "status": "available",
        "setter": "SetCollectionObjectNameArg2",
        "getter": null
      },
      "documentation": "The exact collection/object identity of the source line."
    },
    {
      "argument_id": "point_name",
      "ordinal": 1,
      "sdk_order": 1,
      "mp_name": "Point Name",
      "direction": "input",
      "result_only": "no",
      "semantic_type": "point_name",
      "data_classification": "object_identifier",
      "field_numbers": {
        "request": 2,
        "result": null
      },
      "input": {
        "presence": "required",
        "omission_behavior": "reject_request",
        "default": {
          "status": "none"
        }
      },
      "sdk_binding": {
        "status": "available",
        "setter": "SetPointNameArg",
        "getter": null
      },
      "documentation": "The exact collection, group, and target name for the point to construct."
    }
  ],
  "evidence": [
    {
      "source_id": "maintainer_review",
      "reference": "Issues #49, #53, and #64 exact-target mutation review"
    },
    {
      "source_id": "sa_mp_command_reference",
      "reference": "ConstructionOperations/PointsandGroups/ConstructaPointAtLineMidPoint.htm"
    },
    {
      "source_id": "sa_view_sdk_code",
      "reference": "ConstructionOperations_PointsAndGroups.txt: Construct a Point at line MidPoint"
    }
  ]
}
